[
  {
    "id": "100m-offers",
    "title": "$100M Offers",
    "author": "Alex Hormozi",
    "category": "sales",
    "source": "cover-import",
    "whyInteresting": "Centered on crafting offers so compelling that the value feels obvious and hard to refuse.",
    "keyPromise": "Improve pricing, packaging, and value articulation to create offers that convert more buyers.",
    "effortLevel": "easy",
    "priority": "high",
    "status": "not_started",
    "useCase": "offers, pricing, sales conversion",
    "format": "book",
    "estimatedHours": 5,
    "rating": null,
    "notes": "",
    "createdAt": "2026-03-18T17:12:14.819Z",
    "updatedAt": "2026-03-18T17:12:14.819Z"
  },
  {
    "id": "building-a-storybrand",
    "title": "Building a StoryBrand",
    "author": "Donald Miller",
    "category": "marketing",
    "source": "recommendation",
    "whyInteresting": "Clarifies how to communicate a brand message so customers actually listen, using a proven storytelling framework.",
    "keyPromise": "Learn to cut through the noise and connect with customers by making them the hero of your story.",
    "effortLevel": "easy",
    "priority": "high",
    "status": "not_started",
    "useCase": "marketing, messaging, brand clarity",
    "format": "book",
    "estimatedHours": 5,
    "rating": null,
    "notes": "",
    "createdAt": "2026-03-18T00:00:00.000Z",
    "updatedAt": "2026-03-18T00:00:00.000Z"
  },
  {
    "id": "crossing-the-chasm",
    "title": "Crossing the Chasm",
    "author": "Geoffrey A. Moore",
    "category": "marketing",
    "source": "cover-import",
    "whyInteresting": "A classic guide to taking disruptive products from early adopters to the mainstream market.",
    "keyPromise": "Learn how to position and sequence go-to-market efforts so innovative products can cross from niche traction to broad adoption.",
    "effortLevel": "medium",
    "priority": "high",
    "status": "not_started",
    "useCase": "product marketing, go-to-market, market adoption",
    "format": "book",
    "estimatedHours": 7,
    "rating": null,
    "notes": "",
    "createdAt": "2026-03-18T17:12:10.406Z",
    "updatedAt": "2026-03-18T17:12:10.406Z"
  },
  {
    "id": "gap-selling",
    "title": "Gap Selling",
    "author": "Keenan",
    "category": "sales",
    "source": "cover-import",
    "whyInteresting": "Focuses on diagnosing the gap between a buyer’s current state and desired future state before pitching a solution.",
    "keyPromise": "Sell more effectively by leading customer conversations around problems, impact, and business outcomes instead of product features.",
    "effortLevel": "easy",
    "priority": "high",
    "status": "not_started",
    "useCase": "sales, discovery, objection handling",
    "format": "book",
    "estimatedHours": 6,
    "rating": null,
    "notes": "",
    "createdAt": "2026-03-18T17:12:11.782Z",
    "updatedAt": "2026-03-18T17:12:11.782Z"
  },
  {
    "id": "managing-oneself",
    "title": "Managing Oneself",
    "author": "Peter F. Drucker",
    "category": "productivity",
    "source": "recommendation",
    "whyInteresting": "A concise guide to understanding your own strengths, values, and how you work best — essential for anyone trying to perform at their peak.",
    "keyPromise": "Discover how to place yourself where you can make the greatest contribution.",
    "effortLevel": "easy",
    "priority": "high",
    "status": "not_started",
    "useCase": "self-management, career development",
    "format": "book",
    "estimatedHours": 2,
    "rating": null,
    "notes": "",
    "createdAt": "2026-03-18T00:00:00.000Z",
    "updatedAt": "2026-03-18T00:00:00.000Z"
  },
  {
    "id": "oversubscribed",
    "title": "Oversubscribed",
    "author": "Daniel Priestley",
    "category": "marketing",
    "source": "recommendation",
    "whyInteresting": "Explains how to create demand before launch so a product or service attracts buyers instead of chasing them.",
    "keyPromise": "Learn practical positioning and campaign ideas for building anticipation and becoming the obvious choice in a crowded market.",
    "effortLevel": "easy",
    "priority": "high",
    "status": "not_started",
    "useCase": "demand generation, positioning, launches",
    "format": "book",
    "estimatedHours": 6,
    "rating": null,
    "notes": "",
    "createdAt": "2026-03-18T00:00:00.000Z",
    "updatedAt": "2026-03-18T00:00:00.000Z"
  },
  {
    "id": "pre-suasion",
    "title": "Pre-Suasion",
    "author": "Robert Cialdini",
    "category": "psychology",
    "source": "recommendation",
    "whyInteresting": "Explores how to prepare your audience before delivering your message, so they are already primed to agree.",
    "keyPromise": "Master the art of channeling attention to make your message land before you even say it.",
    "effortLevel": "medium",
    "priority": "maybe",
    "status": "not_started",
    "useCase": "persuasion, sales, communication",
    "format": "book",
    "estimatedHours": 8,
    "rating": null,
    "notes": "",
    "createdAt": "2026-03-18T00:00:00.000Z",
    "updatedAt": "2026-03-18T00:00:00.000Z"
  },
  {
    "id": "the-art-of-thinking-clearly",
    "title": "The Art of Thinking Clearly",
    "author": "Rolf Dobelli",
    "category": "thinking",
    "source": "recommendation",
    "whyInteresting": "A catalogue of 99 cognitive biases and logical errors we make daily, with clear explanations to help avoid them.",
    "keyPromise": "Become aware of your mental blind spots and make significantly better decisions.",
    "effortLevel": "easy",
    "priority": "high",
    "status": "not_started",
    "useCase": "decision-making, critical thinking",
    "format": "book",
    "estimatedHours": 6,
    "rating": null,
    "notes": "",
    "createdAt": "2026-03-18T00:00:00.000Z",
    "updatedAt": "2026-03-18T00:00:00.000Z"
  },
  {
    "id": "the-embedded-entrepreneur",
    "title": "The Embedded Entrepreneur",
    "author": "Arvid Kahl",
    "category": "entrepreneurship",
    "source": "recommendation",
    "whyInteresting": "Focuses on building a business from within an existing community by solving concrete problems for a clearly understood audience.",
    "keyPromise": "See how to find, validate, and grow a sustainable product business with direct customer insight from day one.",
    "effortLevel": "medium",
    "priority": "high",
    "status": "not_started",
    "useCase": "bootstrapping, audience research, product strategy",
    "format": "book",
    "estimatedHours": 7,
    "rating": null,
    "notes": "",
    "createdAt": "2026-03-18T00:00:00.000Z",
    "updatedAt": "2026-03-18T00:00:00.000Z"
  },
  {
    "id": "the-mom-test",
    "title": "The Mom Test",
    "author": "Rob Fitzpatrick",
    "category": "product",
    "source": "cover-import",
    "whyInteresting": "A practical handbook for customer conversations that reveal real problems instead of polite but misleading feedback.",
    "keyPromise": "Learn how to ask better questions so you can validate ideas with honest customer insight.",
    "effortLevel": "easy",
    "priority": "high",
    "status": "not_started",
    "useCase": "customer discovery, startup validation, user research",
    "format": "book",
    "estimatedHours": 3,
    "rating": null,
    "notes": "",
    "createdAt": "2026-03-18T17:12:12.872Z",
    "updatedAt": "2026-03-18T17:12:12.872Z"
  },
  {
    "id": "value-proposition-design",
    "title": "Value Proposition Design",
    "author": "Alex Osterwalder, Yves Pigneur, Greg Bernarda, Alan Smith",
    "category": "product",
    "source": "cover-import",
    "whyInteresting": "Provides structured tools for matching products and services to real customer jobs, pains, and gains.",
    "keyPromise": "Design stronger offers by systematically aligning what you build with what customers actually value.",
    "effortLevel": "medium",
    "priority": "maybe",
    "status": "not_started",
    "useCase": "product strategy, positioning, customer value",
    "format": "book",
    "estimatedHours": 8,
    "rating": null,
    "notes": "",
    "createdAt": "2026-03-18T17:12:13.744Z",
    "updatedAt": "2026-03-18T17:12:13.744Z"
  },
  {
    "id": "yes-50-secrets",
    "title": "Yes!",
    "author": "Noah J. Goldstein, Steve J. Martin, Robert B. Cialdini",
    "category": "psychology",
    "source": "recommendation",
    "whyInteresting": "50 science-backed techniques for persuasion and influence, presented in short, actionable chapters.",
    "keyPromise": "Small, evidence-based changes to how you ask can dramatically increase compliance and cooperation.",
    "effortLevel": "easy",
    "priority": "maybe",
    "status": "not_started",
    "useCase": "negotiation, persuasion, everyday influence",
    "format": "book",
    "estimatedHours": 4,
    "rating": null,
    "notes": "",
    "createdAt": "2026-03-18T00:00:00.000Z",
    "updatedAt": "2026-03-18T00:00:00.000Z"
  },
  {
    "id": "zuruck-an-die-arbeit-wie-aus-business-theatern-wieder-echte-unternehmen-werden",
    "title": "ZURÜCK AN DIE ARBEIT!: Wie aus Business-Theatern wieder echte Unternehmen werden",
    "author": "Lars Vollmer",
    "category": "uncategorized",
    "source": "inventory-import",
    "priority": "low",
    "status": "not_started",
    "format": "book",
    "estimatedHours": null,
    "rating": null,
    "notes": "Publisher: Linde international",
    "createdAt": "2026-03-19T11:05:27.972Z",
    "updatedAt": "2026-03-19T11:05:27.972Z"
  },
  {
    "id": "grundgebiete-der-elektrotechnik-1-gleichstromnetze-operationsver-starkerschaltungen-elektrische-und-magnetische-felder",
    "title": "Grundgebiete der Elektrotechnik 1: Gleichstromnetze, Operationsver-stärkerschaltungen, elektrische und magnetische Felder",
    "author": "H. Clausert, G. Wiesmann",
    "category": "uncategorized",
    "source": "inventory-import",
    "priority": "low",
    "status": "not_started",
    "format": "book",
    "estimatedHours": null,
    "rating": null,